question,answer,language
ما هي لغة Python,Python لغة برمجة سهلة التعلم ومستخدمة في الذكاء الاصطناعي وتحليل البيانات,ar
كيف أتعلم البرمجة,ابدأ بتعلم الأساسيات عبر دورات مجانية ثم اعمل على مشاريع صغيرة لتطبيق ما تعلمته,ar
ما هو الذكاء الاصطناعي,مجال في علوم الحاسوب يهدف لبناء أنظمة قادرة على محاكاة الذكاء البشري مثل التعلم والتفكير,ar
كيف أحصل على وظيفة في البرمجة,ابنِ portfolio قوي على GitHub واعمل مشاريع حقيقية وتعلم التقنيات المطلوبة في سوق العمل,ar
ما أفضل لغة برمجة للمبتدئين,Python هي الأفضل للمبتدئين لأنها سهلة القراءة والكتابة ولها مجتمع كبير,ar
What is Python,Python is an easy-to-learn programming language used in artificial intelligence and data analysis,en
How do I learn programming,Start by learning the basics through free courses then work on small projects to apply what you learned,en
What is artificial intelligence,A field in computer science that aims to build systems capable of mimicking human intelligence such as learning and reasoning,en
How do I get a programming job,Build a strong portfolio on GitHub work on real projects and learn the technologies required in the job market,en
What is the best programming language for beginners,Python is the best for beginners because it is easy to read and write and has a large community,en
